{
  "schema_version": "1.0",
  "record_type": "technology_trend_history_index",
  "timezone": "America/Los_Angeles",
  "ledger_authority": "data/runs",
  "created_at": "2026-09-01T07:40:00-07:00",
  "updated_at": "2026-09-18T08:15:37-07:00",
  "latest_successful_run_id": "technology-trends-2026-09-18",
  "runs": [
    {
      "run_id": "technology-trends-2026-08-26",
      "scheduled_for": "2026-08-26T08:00:00-07:00",
      "observed_at": "2026-08-26T08:31:50-07:00",
      "window_start": "2026-08-25T08:31:50-07:00",
      "window_end": "2026-08-26T08:31:50-07:00",
      "status": "success",
      "run_record_path": "data/runs/2026/2026-08-26/technology-trends-2026-08-26.json",
      "report_path": "reports/2026/2026-08-26/technology-trend-update-technology-trends-2026-08-26.html",
      "finding_count": 5
    },
    {
      "run_id": "technology-trends-2026-08-27",
      "scheduled_for": "2026-08-27T08:00:00-07:00",
      "observed_at": "2026-08-27T08:04:17-07:00",
      "window_start": "2026-08-26T08:31:50-07:00",
      "window_end": "2026-08-27T08:04:17-07:00",
      "status": "success",
      "run_record_path": "data/runs/2026/2026-08-27/technology-trends-2026-08-27.json",
      "report_path": "reports/2026/2026-08-27/technology-trend-update-technology-trends-2026-08-27.html",
      "finding_count": 5
    },
    {
      "run_id": "technology-trends-2026-08-28",
      "scheduled_for": "2026-08-28T08:00:00-07:00",
      "observed_at": "2026-08-28T08:05:57-07:00",
      "window_start": "2026-08-27T08:04:17-07:00",
      "window_end": "2026-08-28T08:05:57-07:00",
      "status": "success",
      "run_record_path": "data/runs/2026/2026-08-28/technology-trends-2026-08-28.json",
      "report_path": "reports/2026/2026-08-28/technology-trend-update-technology-trends-2026-08-28.html",
      "finding_count": 5
    },
    {
      "run_id": "technology-trends-2026-08-31",
      "scheduled_for": "2026-08-31T08:00:00-07:00",
      "observed_at": "2026-08-31T08:13:32-07:00",
      "window_start": "2026-08-30T08:13:32-07:00",
      "window_end": "2026-08-31T08:13:32-07:00",
      "status": "success",
      "run_record_path": "data/runs/2026/2026-08-31/technology-trends-2026-08-31.json",
      "report_path": "reports/2026/2026-08-31/technology-trend-update-technology-trends-2026-08-31.html",
      "finding_count": 5
    },
    {
      "run_id": "technology-trends-2026-09-18",
      "scheduled_for": "2026-09-18T08:00:00-07:00",
      "observed_at": "2026-09-18T07:59:17-07:00",
      "window_start": "2026-08-31T08:13:32-07:00",
      "window_end": "2026-09-18T07:59:17-07:00",
      "status": "success",
      "run_record_path": "data/runs/2026/2026-09-18/technology-trends-2026-09-18.json",
      "report_path": "reports/2026/2026-09-18/technology-trend-update-technology-trends-2026-09-18.html",
      "finding_count": 5
    }
  ],
  "finding_events": [
    {
      "event_key": "airbound-andhra-pradesh-deployment",
      "latest_finding_id": "airbound-andhra-pradesh-deployment-2026-08-26",
      "first_seen_run_id": "technology-trends-2026-08-26",
      "last_seen_run_id": "technology-trends-2026-08-26",
      "source_urls": [
        "https://www.globenewswire.com/de/news-release/2026/08/25/3350182/0/en/airbound-scales-new-class-of-aircraft-to-change-the-economics-of-flight.html"
      ]
    },
    {
      "event_key": "anthropic-model-hardware-standard-preview",
      "latest_finding_id": "anthropic-model-hardware-standard-preview-2026-08-28",
      "first_seen_run_id": "technology-trends-2026-08-28",
      "last_seen_run_id": "technology-trends-2026-08-28",
      "source_urls": [
        "https://www.anthropic.com/news/model-hardware-standard-research-preview"
      ]
    },
    {
      "event_key": "aptiv-nvidia-production-edge-ai",
      "latest_finding_id": "aptiv-nvidia-production-edge-ai-2026-08-26",
      "first_seen_run_id": "technology-trends-2026-08-26",
      "last_seen_run_id": "technology-trends-2026-08-26",
      "source_urls": [
        "https://www.aptiv.com/en/newsroom/article/aptiv-to-deliver-production-ready-edge-ai-with-long-term-support-with-nvidia"
      ]
    },
    {
      "event_key": "aws-nvidia-two-million-gpu-commitment",
      "latest_finding_id": "aws-nvidia-two-million-gpu-commitment-2026-08-27",
      "first_seen_run_id": "technology-trends-2026-08-27",
      "last_seen_run_id": "technology-trends-2026-08-27",
      "source_urls": [
        "https://nvidianews.nvidia.com/news/aws-and-nvidia-to-deliver-2-million-additional-gpus-and-next-generation-infrastructure-for-agentic-and-physical-ai"
      ]
    },
    {
      "event_key": "biosidus-biologics-capacity-online",
      "latest_finding_id": "biosidus-biologics-capacity-online-2026-08-27",
      "first_seen_run_id": "technology-trends-2026-08-27",
      "last_seen_run_id": "technology-trends-2026-08-27",
      "source_urls": [
        "https://www.prnewswire.com/news-releases/biosidus-expands-biologics-manufacturing-capacity-and-strengthens-global-supply-capabilities-for-agalsidase-beta-302860963.html"
      ]
    },
    {
      "event_key": "eurohpc-lumi-ai-procurement-contract",
      "latest_finding_id": "eurohpc-lumi-ai-procurement-contract-2026-08-31",
      "first_seen_run_id": "technology-trends-2026-08-31",
      "last_seen_run_id": "technology-trends-2026-08-31",
      "source_urls": [
        "https://www.eurohpc-ju.europa.eu/eurohpc-ju-signs-contract-deploy-lumi-ai-supercomputer-2026-08-31_en",
        "https://newsroom.amd.com/news/amd-instinct-gpus-epyc-cpus-power-lumi-ai-supercomputer/"
      ]
    },
    {
      "event_key": "fda-fayuvi-sanfilippo-gene-therapy-approval",
      "latest_finding_id": "fda-fayuvi-sanfilippo-gene-therapy-approval-2026-09-18",
      "first_seen_run_id": "technology-trends-2026-09-18",
      "last_seen_run_id": "technology-trends-2026-09-18",
      "source_urls": [
        "https://www.fda.gov/news-events/press-announcements/fda-approves-first-gene-therapy-pediatric-patients-sanfilippo-syndrome-type"
      ]
    },
    {
      "event_key": "fda-lisraya-dermatomyositis-approval",
      "latest_finding_id": "fda-lisraya-dermatomyositis-approval-2026-08-28",
      "first_seen_run_id": "technology-trends-2026-08-28",
      "last_seen_run_id": "technology-trends-2026-08-28",
      "source_urls": [
        "https://www.fda.gov/news-events/press-announcements/fda-approves-first-oral-drug-indicated-treat-dermatomyositis-adults"
      ]
    },
    {
      "event_key": "fda-rasonque-pancreatic-cancer-approval",
      "latest_finding_id": "fda-rasonque-pancreatic-cancer-approval-2026-08-27",
      "first_seen_run_id": "technology-trends-2026-08-27",
      "last_seen_run_id": "technology-trends-2026-08-27",
      "source_urls": [
        "https://www.fda.gov/drugs/resources-information-approved-drugs/fda-approves-daraxonrasib-metastatic-pancreatic-adenocarcinoma"
      ]
    },
    {
      "event_key": "fda-ziihera-first-line-approval",
      "latest_finding_id": "fda-ziihera-first-line-approval-2026-08-26",
      "first_seen_run_id": "technology-trends-2026-08-26",
      "last_seen_run_id": "technology-trends-2026-08-26",
      "source_urls": [
        "https://www.fda.gov/drugs/resources-information-approved-drugs/fda-approves-zanidatamab-hrii-and-tislelizumab-jsgr-her2-positive-gastric-gastroesophageal-junction"
      ]
    },
    {
      "event_key": "formic-oakland-robotics-facility",
      "latest_finding_id": "formic-oakland-robotics-facility-2026-08-26",
      "first_seen_run_id": "technology-trends-2026-08-26",
      "last_seen_run_id": "technology-trends-2026-08-26",
      "source_urls": [
        "https://www.businesswire.com/news/home/20260826975448/en/Formic-Opens-Oakland-Facility-Anchoring-Humanoid-and-Physical-AI-Expansion-in-the-Bay-Area-Alongside-Tesla-and-Amazon"
      ]
    },
    {
      "event_key": "humain-amd-cisco-saudi-ai-compute-live",
      "latest_finding_id": "humain-amd-cisco-saudi-ai-compute-live-2026-08-31",
      "first_seen_run_id": "technology-trends-2026-08-31",
      "last_seen_run_id": "technology-trends-2026-08-31",
      "source_urls": [
        "https://newsroom.cisco.com/c/r/newsroom/en/us/a/y2026/m08/amd-cisco-and-humain-expand-saudi-arabia-ai-infrastructure.html"
      ]
    },
    {
      "event_key": "iem-san-antonio-power-equipment-factory",
      "latest_finding_id": "iem-san-antonio-power-equipment-factory-2026-08-26",
      "first_seen_run_id": "technology-trends-2026-08-26",
      "last_seen_run_id": "technology-trends-2026-08-26",
      "source_urls": [
        "https://www.iemfg.com/news-stories/iem-announces-200-million-manufacturing-facility-in-san-antonio-creating-jobs-and-expanding-us-production-capacity-to-support-business-growth/"
      ]
    },
    {
      "event_key": "lam-research-oregon-ai-chip-lab",
      "latest_finding_id": "lam-research-oregon-ai-chip-lab-2026-08-27",
      "first_seen_run_id": "technology-trends-2026-08-27",
      "last_seen_run_id": "technology-trends-2026-08-27",
      "source_urls": [
        "https://newsroom.lamresearch.com/2026-08-26-Lam-Research-Breaks-Ground-on-New-Oregon-Lab-to-Accelerate-AI-Era-Semiconductor-Research-Development-Locally%2C-Globally"
      ]
    },
    {
      "event_key": "nasa-quantum-gravity-sensor-hardware-development",
      "latest_finding_id": "nasa-quantum-gravity-sensor-hardware-development-2026-08-28",
      "first_seen_run_id": "technology-trends-2026-08-28",
      "last_seen_run_id": "technology-trends-2026-08-28",
      "source_urls": [
        "https://ir.infleqtion.com/news-events/press-releases/detail/207/nasa-awards-infleqtion-20-million-as-worlds-first-quantum-gravity-mission-advances-toward-flight"
      ]
    },
    {
      "event_key": "nasa-roman-space-telescope-launch",
      "latest_finding_id": "nasa-roman-instrument-activation-2026-09-18",
      "first_seen_run_id": "technology-trends-2026-08-31",
      "last_seen_run_id": "technology-trends-2026-09-18",
      "source_urls": [